{
  "declared_lockfile_ref": "link://locks/fixture-lock",
  "declared_materials": [],
  "dependency_drift": {
    "count": 0,
    "mismatches": []
  },
  "evidence_manifest_ref": "evmanifest-9e27845c-d239-4399-ae8d-f2c4c5874b25",
  "id": "depreport-fff81e31-e5b7-4e7f-8cac-e2359045bad3",
  "integrity_signature": "fixture",
  "runtime_imports": [],
  "sbom_ref": "fixture",
  "supply_chain_checks": {
    "cve_policy_pass": true,
    "signatures_valid": true
  }
}