{
  "declared_lockfile_ref": "link://locks/fixture-lock",
  "declared_materials": [],
  "dependency_drift": {
    "count": 0,
    "mismatches": []
  },
  "evidence_manifest_ref": "evmanifest-bd70605c-ca93-4e45-8073-58cd259ecd65",
  "id": "depreport-417c2d9d-785f-4648-bdf3-79324948a88c",
  "integrity_signature": "fixture",
  "runtime_imports": [],
  "sbom_ref": "fixture",
  "supply_chain_checks": {
    "cve_policy_pass": true,
    "signatures_valid": true
  }
}