{
  "declared_lockfile_ref": "link://locks/fixture-lock",
  "declared_materials": [],
  "dependency_drift": {
    "count": 0,
    "mismatches": []
  },
  "evidence_manifest_ref": "evmanifest-67972cbe-3dce-49fe-a499-e456a279fd49",
  "id": "depreport-5733388e-fda2-4fd7-86d1-c28985cea530",
  "integrity_signature": "fixture",
  "runtime_imports": [],
  "sbom_ref": "fixture",
  "supply_chain_checks": {
    "cve_policy_pass": true,
    "signatures_valid": true
  }
}