{
  "declared_lockfile_ref": "link://locks/fixture-lock",
  "declared_materials": [],
  "dependency_drift": {
    "count": 0,
    "mismatches": []
  },
  "evidence_manifest_ref": "evmanifest-f82a196f-2971-4584-ac90-26d13308cf2f",
  "id": "depreport-0e561250-ef31-4176-9924-ed27db5c88b9",
  "integrity_signature": "fixture",
  "runtime_imports": [],
  "sbom_ref": "fixture",
  "supply_chain_checks": {
    "cve_policy_pass": true,
    "signatures_valid": true
  }
}