{
  "declared_lockfile_ref": "link://locks/fixture-lock",
  "declared_materials": [],
  "dependency_drift": {
    "count": 0,
    "mismatches": []
  },
  "evidence_manifest_ref": "evmanifest-c55803cd-bad4-4668-8ccf-c279d6a013a8",
  "id": "depreport-2e1bd0f5-3950-4dc4-8d91-48e1dc0cff78",
  "integrity_signature": "fixture",
  "runtime_imports": [],
  "sbom_ref": "fixture",
  "supply_chain_checks": {
    "cve_policy_pass": true,
    "signatures_valid": true
  }
}